{
  "package.input": [
    "./scripts/**/initial*.sql",
    "./src/**/*.sql",
    "./scripts/**/final*.sql"
  ],
  "package.exclude": [
    "./scripts/**/+(file|run)*.sql"
  ],
  "package.output": "./deploy/{schema-name}.sql",
  "package.encoding": "utf8",
  "package.templating": false,
  "source.input": [
    "./src/**/*.sql"
  ],
  "source.encoding": "utf8",
  "compile.warnings": "NONE",
  "compile.force": true,
  "compile.stageFile": false,
  "version.number": "0.0.1",
  "version.description": "New feature",
  "version.releaseDate": "2099-01-01",
  "test.input": [
    "./test/**/*.test.sql"
  ],
  "import.getDdlFunction": "dbms_metadata.get_ddl",
  "source.pattern": {
    "packageSpec": "./src/{schema-name}/PACKAGES/{object-name}.sql",
    "packageBody": "./src/{schema-name}/PACKAGE_BODIES/{object-name}.sql",
    "trigger": "./src/{schema-name}/TRIGGERS/{object-name}.sql",
    "typeSpec": "./src/{schema-name}/TYPES/{object-name}.sql",
    "typeBody": "./src/{schema-name}/TYPE_BODIES/{object-name}.sql",
    "view": "./src/{schema-name}/VIEWS/{object-name}.sql",
    "function": "./src/{schema-name}/FUNCTIONS/{object-name}.sql",
    "procedure": "./src/{schema-name}/PROCEDURES/{object-name}.sql",
    "table": "./src/{schema-name}/TABLES/{object-name}.sql",
    "synonym": "./src/{schema-name}/SYNONYMS/{object-name}.sql",
    "apex": "./src/{schema-name}/APEX/{object-name}.sql"
  },
  "import.ease": false
}